[
  {
    "id": "addon_botox_hydrafacial",
    "parentServiceId": "svc_botox",
    "childServiceId": "svc_hydrafacial",
    "optionNameKey": "addon.botox.hydrafacial"
  },
  {
    "id": "addon_botox_casmara_purifying",
    "parentServiceId": "svc_botox",
    "childServiceId": "svc_casmara_purifying",
    "optionNameKey": "addon.botox.casmara_purifying"
  },
  {
    "id": "addon_botox_casmara_infinity",
    "parentServiceId": "svc_botox",
    "childServiceId": "svc_casmara_infinity",
    "optionNameKey": "addon.botox.casmara_infinity"
  },
  {
    "id": "addon_botox_casmara_retinol",
    "parentServiceId": "svc_botox",
    "childServiceId": "svc_casmara_retinol_proage",
    "optionNameKey": "addon.botox.casmara_retinol"
  },
  {
    "id": "addon_botox_pdo_threads",
    "parentServiceId": "svc_botox",
    "childServiceId": "svc_pdo_biostimulating_threads",
    "optionNameKey": "addon.botox.pdo_threads"
  }
]
